{"$schema":"https://json-schema.org/draft/2020-12/schema","$id":"https://thedailyline.bet/schemas/video/v1/video-render-spec.schema.json","title":"VideoRenderSpec","type":"object","additionalProperties":false,"required":["schema_version","render_spec_id","video_story_id","creative_variant_id","template_ref","brand_release_ref","component_release_ref","renderer_adapter_ref","renderer_release_ref","render_profile","scene_specs","asset_manifest_ref","asset_manifest_digest","script_ref","script_digest","voice_package_ref","voice_package_digest","caption_package_ref","caption_package_digest","music_asset_ref","sfx_asset_refs","disclaimer_ref","safe_zone_profile_ref","created_at","render_spec_digest"],"properties":{"schema_version":{"const":"video-render-spec.v1"},"render_spec_id":{"$ref":"common.schema.json#/$defs/Id"},"video_story_id":{"$ref":"common.schema.json#/$defs/Ref"},"creative_variant_id":{"$ref":"common.schema.json#/$defs/Ref"},"template_ref":{"$ref":"common.schema.json#/$defs/Ref"},"brand_release_ref":{"$ref":"common.schema.json#/$defs/Ref"},"component_release_ref":{"$ref":"common.schema.json#/$defs/Ref"},"renderer_adapter_ref":{"$ref":"common.schema.json#/$defs/Ref"},"renderer_release_ref":{"$ref":"common.schema.json#/$defs/Ref"},"render_profile":{"$ref":"#/$defs/RenderProfile"},"scene_specs":{"type":"array","minItems":1,"items":{"type":"object"}},"asset_manifest_ref":{"$ref":"common.schema.json#/$defs/Ref"},"asset_manifest_digest":{"$ref":"common.schema.json#/$defs/Digest"},"script_ref":{"$ref":"common.schema.json#/$defs/Ref"},"script_digest":{"$ref":"common.schema.json#/$defs/Digest"},"voice_package_ref":{"type":["string","null"]},"voice_package_digest":{"oneOf":[{"$ref":"common.schema.json#/$defs/Digest"},{"type":"null"}]},"caption_package_ref":{"$ref":"common.schema.json#/$defs/Ref"},"caption_package_digest":{"$ref":"common.schema.json#/$defs/Digest"},"music_asset_ref":{"type":["string","null"]},"sfx_asset_refs":{"$ref":"common.schema.json#/$defs/RefSet"},"disclaimer_ref":{"$ref":"common.schema.json#/$defs/Ref"},"safe_zone_profile_ref":{"$ref":"common.schema.json#/$defs/Ref"},"created_at":{"$ref":"common.schema.json#/$defs/Timestamp"},"render_spec_digest":{"$ref":"common.schema.json#/$defs/Digest"}},"$defs":{"RenderProfile":{"type":"object","additionalProperties":false,"required":["profile_id","width","height","fps","pixel_aspect_ratio","container","codec_profile_ref","audio_profile_ref","max_duration_ms","min_duration_ms","safe_zone_profile_ref","platform_intent"],"properties":{"profile_id":{"$ref":"common.schema.json#/$defs/Id"},"width":{"type":"integer","minimum":1},"height":{"type":"integer","minimum":1},"fps":{"type":"integer","minimum":1,"maximum":240},"pixel_aspect_ratio":{"type":"string","pattern":"^[1-9][0-9]*:[1-9][0-9]*$"},"container":{"type":"string","minLength":1},"codec_profile_ref":{"$ref":"common.schema.json#/$defs/Ref"},"audio_profile_ref":{"$ref":"common.schema.json#/$defs/Ref"},"max_duration_ms":{"type":"integer","minimum":1},"min_duration_ms":{"type":"integer","minimum":0},"safe_zone_profile_ref":{"$ref":"common.schema.json#/$defs/Ref"},"platform_intent":{"$ref":"common.schema.json#/$defs/StringSet"}}}}}
