{"schema_version":"video-render-spec.v1","render_spec_id":"render-spec.mlb.sf-lad.1a","video_story_id":"story.mlb.sf-lad.20260908.1","creative_variant_id":"creative.mlb.sf-lad.20260908.1a","template_ref":"single_pick_v1@1.0.0","brand_release_ref":"daily-line-brand@1.0.0","component_release_ref":"dlve-components@1.0.0","renderer_adapter_ref":"remotion-adapter@1.0.0","renderer_release_ref":"remotion-bundle@fixture","render_profile":{"profile_id":"vertical_social_v1","width":1080,"height":1920,"fps":30,"pixel_aspect_ratio":"1:1","container":"mp4","codec_profile_ref":"h264-social.v1","audio_profile_ref":"aac-social.v1","max_duration_ms":60000,"min_duration_ms":8000,"safe_zone_profile_ref":"vertical-social-safe.v1","platform_intent":["tiktok","instagram_reels","youtube_shorts"]},"scene_specs":[{"scene_id":"scene.hook","duration_ms":3000},{"scene_id":"scene.reason","duration_ms":5000},{"scene_id":"scene.pick","duration_ms":3500},{"scene_id":"scene.outro","duration_ms":3500}],"asset_manifest_ref":"assetmanifest.mlb.sf-lad.1a","asset_manifest_digest":"sha256:7d95551e208353235278647cbe6359d32671270de9e8a32d13f3d2c9df3da752","script_ref":"script.mlb.sf-lad.1a","script_digest":"sha256:8632327934e57ad2093f5f167c3dfaf588a4fc566f3e3260c377b6cb27432d64","voice_package_ref":null,"voice_package_digest":null,"caption_package_ref":"captions.mlb.sf-lad.1a","caption_package_digest":"sha256:b7984b93ebc7d22ca81b0a2b18f3c401ed5c2ca309e3ce47b1538f5f7888e7d4","music_asset_ref":null,"sfx_asset_refs":[],"disclaimer_ref":"sports-betting-general.v1","safe_zone_profile_ref":"vertical-social-safe.v1","created_at":"2026-09-08T16:11:00Z","render_spec_digest":"sha256:93a3f7dc5735d086fd1ad78b5f0863826229d4c3f7be6b9d12ee51384ab7706d"}
